{"advisory":{"claim_coverage":{"covered":0,"reasons":[],"status":"not-applicable","total":0},"diagram_label_coverage":{"covered":0,"reasons":[],"status":"not-applicable","total":0},"evidence_sources":{"covered":0,"reasons":[],"status":"not-applicable","total":0},"language_truth_pairs":{"covered":0,"reasons":[],"status":"not-applicable","total":0},"observable_commands":{"basis_points":10000,"covered":1,"reasons":[],"status":"measured","total":1},"section_intents":{"covered":0,"reasons":[],"status":"not-applicable","total":0},"visual_provenance":{"covered":0,"reasons":[],"status":"not-applicable","total":0}},"behavior":{"commands":[{"command_id":"quick-start:fixture","exit_code":0,"observation_sha256":"0000000000000000000000000000000000000000000000000000000000000000","reasons":[],"status":"pass","verification":"verified"}],"observable_commands":1,"reasons":[],"status":"pass","total_commands":1},"behavior_required":true,"bundle_sha256":"0000000000000000000000000000000000000000000000000000000000000000","decision_basis":"hard-gates-with-configured-behavior","hard_gate":{"findings":[],"status":"pass"},"schema_version":2,"status":"pass"}
